{
  "lorekeeper": "0.1",
  "kind": "index",
  "id": "sherlock-holmes.study-in-scarlet",
  "work": {
    "title": "A Study in Scarlet",
    "authors": [
      "Arthur Conan Doyle"
    ],
    "language": "en"
  },
  "editions": [
    {
      "textHash": "3ba1a6316fb65ab87f83bbbc65d66b82d0313be6a836e20770dc9571bd8d4ff5",
      "fileHash": "d65612d1c87ec1f7fed290361d11278cdbaf8509d5c231b1ff0981049331b7e7",
      "label": "pg244.epub",
      "builtFrom": true
    }
  ],
  "coverage": {
    "complete": false,
    "through": "toc06.para51"
  },
  "provenance": {
    "generator": {
      "name": "lorekeeper-generate",
      "version": "0.2.0",
      "model": "claude-haiku-5-5",
      "promptSet": "extract-v2"
    },
    "contributors": [
      {
        "name": "claude-haiku-5-5 via lorekeeper-generate",
        "role": "generator"
      }
    ],
    "review": [
      {
        "by": "lorekeeper-generate",
        "date": "2026-10-21",
        "status": "unreviewed"
      }
    ],
    "created": "2026-10-21T22:36:46Z",
    "updated": "2026-10-21T22:37:05Z",
    "license": "CC0-1.0"
  },
  "anchors": [
    {
      "id": "toc05.para01",
      "fp": "ed131b9e3d13f696",
      "seq": 31
    },
    {
      "id": "toc05.para02",
      "fp": "ab28352abd2f8b28",
      "seq": 32
    },
    {
      "id": "toc05.para03",
      "fp": "cfe66719d894689c",
      "seq": 33
    },
    {
      "id": "toc05.para05",
      "fp": "96e69275a85f6afd",
      "seq": 35
    },
    {
      "id": "toc05.para06",
      "fp": "4d9d535509296a43",
      "seq": 36
    },
    {
      "id": "toc05.para34",
      "fp": "2b1f5428714cbaa7",
      "seq": 64
    },
    {
      "id": "toc05.para40",
      "fp": "d2bda7f81bce8094",
      "seq": 70
    },
    {
      "id": "toc05.para51",
      "fp": "3b121120601de98c",
      "seq": 81
    },
    {
      "id": "toc05.para52",
      "fp": "bd54f49031fd6d23",
      "seq": 82
    },
    {
      "id": "toc05.para57",
      "fp": "1be8b1a7ea3483d2",
      "seq": 87
    },
    {
      "id": "toc05.para60",
      "fp": "3f602e0e1311a5a6",
      "seq": 90
    },
    {
      "id": "toc05.para62",
      "fp": "2441113b09c52a75",
      "seq": 92
    },
    {
      "id": "toc05.para69",
      "fp": "2eae6519269e5247",
      "seq": 99
    },
    {
      "id": "toc06.para01",
      "fp": "ab283eb2075e6a74",
      "seq": 101
    },
    {
      "id": "toc06.para02",
      "fp": "866b8c0f51ae6d41",
      "seq": 102
    },
    {
      "id": "toc06.para04",
      "fp": "4992f4a3f744dddf",
      "seq": 104
    },
    {
      "id": "toc06.para06",
      "fp": "33b412d20e241525",
      "seq": 106
    },
    {
      "id": "toc06.para09",
      "fp": "5c942c26a3e5980e",
      "seq": 109
    },
    {
      "id": "toc06.para16",
      "fp": "9d66abbe8986ebb4",
      "seq": 116
    },
    {
      "id": "toc06.para17",
      "fp": "8c64fd96d194ff0e",
      "seq": 117
    },
    {
      "id": "toc06.para19",
      "fp": "9a1bf352ae5da30d",
      "seq": 119
    },
    {
      "id": "toc06.para20",
      "fp": "28273a24bab21dfb",
      "seq": 120
    },
    {
      "id": "toc06.para24",
      "fp": "fe72c108568d6990",
      "seq": 124
    },
    {
      "id": "toc06.para28",
      "fp": "46032c01f194bf97",
      "seq": 128
    },
    {
      "id": "toc06.para32",
      "fp": "c13c70f397bb9917",
      "seq": 132
    },
    {
      "id": "toc06.para35",
      "fp": "0e169aedbb01ceaf",
      "seq": 135
    },
    {
      "id": "toc06.para36",
      "fp": "b7c36e9c7bb06dfc",
      "seq": 136
    },
    {
      "id": "toc06.para37",
      "fp": "d49ee7dcf61dc92f",
      "seq": 137
    },
    {
      "id": "toc06.para38",
      "fp": "14b06c559653598f",
      "seq": 138
    },
    {
      "id": "toc06.para40",
      "fp": "a767037db7b083ac",
      "seq": 140
    },
    {
      "id": "toc06.para46",
      "fp": "5242600effadc0f3",
      "seq": 146
    },
    {
      "id": "toc06.para51",
      "fp": "16d3b22cc97d0188",
      "seq": 151
    }
  ],
  "entities": [
    {
      "id": "fifth-northumberland-fusiliers",
      "type": "group",
      "from": "toc05.para01",
      "names": [
        {
          "value": "Fifth Northumberland Fusiliers",
          "kind": "primary",
          "from": "toc05.para01"
        }
      ],
      "facets": [
        {
          "id": "study-in-scarlet.fifth-northumberland-fusiliers.1",
          "from": "toc05.para01",
          "basis": "stated",
          "evidence": [
            "toc05.para01"
          ],
          "text": "The regiment Watson was attached to as Assistant Surgeon, stationed in India."
        }
      ]
    },
    {
      "id": "netley",
      "type": "place",
      "from": "toc05.para01",
      "names": [
        {
          "value": "Netley",
          "kind": "primary",
          "from": "toc05.para01"
        }
      ],
      "facets": [
        {
          "id": "study-in-scarlet.netley.1",
          "from": "toc05.para01",
          "basis": "stated",
          "evidence": [
            "toc05.para01"
          ],
          "text": "Where Watson completed the army surgeon course after his medical degree."
        }
      ]
    },
    {
      "id": "sherlock-holmes",
      "type": "person",
      "from": "toc05.para01",
      "names": [
        {
          "value": "Sherlock Holmes",
          "kind": "primary",
          "from": "toc05.para01"
        },
        {
          "value": "Mr. Sherlock Holmes",
          "kind": "alias",
          "from": "toc06.para46"
        }
      ],
      "facets": [
        {
          "id": "study-in-scarlet.sherlock-holmes.1",
          "from": "toc05.para34",
          "basis": "stated",
          "evidence": [
            "toc05.para34"
          ],
          "text": "A man working at the hospital's chemical laboratory, eccentric and absorbed in unusual scientific studies."
        },
        {
          "id": "study-in-scarlet.sherlock-holmes.2",
          "from": "toc05.para52",
          "basis": "stated",
          "evidence": [
            "toc05.para52"
          ],
          "text": "Holmes proposes sharing rooms in Baker Street and seems pleased at the idea of a lodger."
        },
        {
          "id": "study-in-scarlet.sherlock-holmes.3",
          "from": "toc06.para02",
          "basis": "stated",
          "evidence": [
            "toc06.para02"
          ],
          "text": "Holmes is quiet and regular in habits, sometimes lying idle for days, and seems not to be a drug user."
        },
        {
          "id": "study-in-scarlet.sherlock-holmes.4",
          "from": "toc06.para09",
          "basis": "stated",
          "evidence": [
            "toc06.para09"
          ],
          "text": "Holmes believes the brain is like an attic and deliberately excludes knowledge he thinks useless to his work."
        },
        {
          "id": "study-in-scarlet.sherlock-holmes.5",
          "from": "toc06.para28",
          "basis": "stated",
          "evidence": [
            "toc06.para28"
          ],
          "text": "Holmes reveals he is a consulting detective whom Scotland Yard-type detectives and private agents consult for their cases."
        }
      ]
    },
    {
      "id": "berkshires",
      "type": "group",
      "from": "toc05.para02",
      "names": [
        {
          "value": "Berkshires",
          "kind": "primary",
          "from": "toc05.para02"
        }
      ],
      "facets": [
        {
          "id": "study-in-scarlet.berkshires.1",
          "from": "toc05.para02",
          "basis": "stated",
          "evidence": [
            "toc05.para02"
          ],
          "text": "The regiment Watson was attached to during the Afghan campaign, where he served at Maiwand."
        }
      ]
    },
    {
      "id": "maiwand",
      "type": "concept",
      "from": "toc05.para02",
      "names": [
        {
          "value": "Maiwand",
          "kind": "primary",
          "from": "toc05.para02"
        }
      ],
      "facets": [
        {
          "id": "study-in-scarlet.maiwand.1",
          "from": "toc05.para02",
          "basis": "stated",
          "evidence": [
            "toc05.para02"
          ],
          "text": "A fatal battle in the Afghan campaign where Watson was wounded in the shoulder."
        }
      ]
    },
    {
      "id": "murray",
      "type": "person",
      "from": "toc05.para02",
      "names": [
        {
          "value": "Murray",
          "kind": "primary",
          "from": "toc05.para02"
        }
      ],
      "facets": [
        {
          "id": "study-in-scarlet.murray.1",
          "from": "toc05.para02",
          "basis": "stated",
          "evidence": [
            "toc05.para02"
          ],
          "text": "Watson's orderly who saved him at the battle of Maiwand by carrying him to safety."
        }
      ]
    },
    {
      "id": "peshawar",
      "type": "place",
      "from": "toc05.para03",
      "names": [
        {
          "value": "Peshawar",
          "kind": "primary",
          "from": "toc05.para03"
        }
      ],
      "facets": [
        {
          "id": "study-in-scarlet.peshawar.1",
          "from": "toc05.para03",
          "basis": "stated",
          "evidence": [
            "toc05.para03"
          ],
          "text": "The base hospital where Watson was taken after his wounding and later struck by fever."
        }
      ]
    },
    {
      "id": "barts",
      "type": "place",
      "from": "toc05.para05",
      "names": [
        {
          "value": "Barts",
          "kind": "primary",
          "from": "toc05.para05"
        }
      ],
      "facets": [
        {
          "id": "study-in-scarlet.barts.1",
          "from": "toc05.para05",
          "basis": "stated",
          "evidence": [
            "toc05.para05"
          ],
          "text": "The hospital where Stamford once dressed wounds under Watson."
        }
      ]
    },
    {
      "id": "criterion-bar",
      "type": "place",